{
  "schemaVersion": 1,
  "recordType": "ledger",
  "rulesetVersion": "1.0.0",
  "recordRevision": 2,
  "owner": {
    "accountId": "1001",
    "profileRepositoryId": "9001"
  },
  "repositories": [
    {
      "id": "9001",
      "firstObservedAt": "2026-10-15T00:55:00Z",
      "ownershipAtFirstObservation": "self",
      "tracking": "active",
      "discoveredVia": [
        "automatic"
      ]
    },
    {
      "id": "9002",
      "firstObservedAt": "2026-10-15T02:00:00Z",
      "ownershipAtFirstObservation": "other",
      "tracking": "active",
      "discoveredVia": [
        "additional"
      ]
    }
  ],
  "scopes": [
    {
      "id": "v1:sha256:57ef5775ba19f381c51f53fea413c885364935ea361c6f959d522197c9fd7c1b",
      "rulesetVersion": "1.0.0",
      "analysisConfigHash": "v1:sha256:68dfaf3c54c2062cbec3962935f02e0358acdc49ea5e8b7fd3e6d3f7782d249d",
      "repositoryIds": [
        "9001"
      ]
    }
  ],
  "coverage": [
    {
      "startDate": "2026-07-17",
      "endDateExclusive": "2026-10-15",
      "scopeId": "v1:sha256:57ef5775ba19f381c51f53fea413c885364935ea361c6f959d522197c9fd7c1b",
      "complete": true,
      "observedAt": "2026-10-15T01:00:00Z"
    }
  ],
  "facts": [
    {
      "eventKey": "v1:sha256:1eec63024f149292692f2e7b8938b4d45dc7ee614c5d1f758a334a94ee10726c",
      "kind": "merged_pr",
      "repositoryId": "9001",
      "occurredAt": "2026-10-14T06:00:00Z",
      "families": [
        "knowledge"
      ],
      "prKey": "v1:sha256:5fad785a80071f2be8439020563f9af49d439c1dab96b64a74d41736fd926422",
      "bugEvidenced": false
    }
  ],
  "days": [
    {
      "date": "2026-10-14",
      "scopeId": "v1:sha256:57ef5775ba19f381c51f53fea413c885364935ea361c6f959d522197c9fd7c1b",
      "byRepository": [
        {
          "repositoryId": "9001",
          "familyUnits": {
            "craft": 0,
            "guard": 0,
            "knowledge": 1,
            "verification": 0,
            "recovery": 0,
            "operations": 0
          }
        }
      ],
      "xp": {
        "validDay": 10,
        "authoredContributionDay": 10,
        "mergedPrs": 20,
        "reviews": 0,
        "releases": 0,
        "triage": 0,
        "total": 40
      },
      "creditedKeys": {
        "mergedPrs": [
          "v1:sha256:5fad785a80071f2be8439020563f9af49d439c1dab96b64a74d41736fd926422"
        ],
        "reviews": [],
        "releases": []
      }
    }
  ],
  "corrections": []
}
